name,wm_ID,rating,num_of_rating,price,feat_labels,feat_values,about_text,about_details
"Bluetooth 5.0 True Wireless Earbuds Headphones w/ Charging Case, One-Step Pairing, IP67 Waterproof, 20Hrs Playtime In-Ear Headset Earphone Hands-free Earpiece Built-in Mic for iPhone/Android Black",Walmart #  586219737,4.6,77 ratings,$28.99 ,"['Wireless', 'Wireless Technology']","['Y', 'Bluetooth']","Why Choose GPED Wireless Earbuds? ✔GPED bluetooth wireless earbuds can work individually (each earbuds pairs to seperate cellphones).  ✔Automatically power on and pairs each other, don't worry about complicated connections.  ✔Can provide 4 times fully charging by the charging case, one full charging can support more than 5 hours playtime, so you don’t worry the bluetooth wireless headphones is low battery or no battery.   Product Features:   Latest Bluetooth 5.0 & Auto Pairing Our true wireless earbuds with the most advanced Bluetooth 5.0 technology. It owns more stable bluetooth connection and faster transmission speed. Rid of cords, enjoy real wireless. Audio won't cut in and out anymore, your music world will be disturbed no longer. Meanwhile, the auto pairing connection will be more convenient for you to connet headphones with your phones, no complicated connections.   Waterproof & Sweatproof Design IP67 Waterproof Nano-coating efficiently protects the bluetooth wireless earbuds and charging case from sweat or water, perfect for jogging, hiking, yoga, running, skiing, sport, etc. ( NOT for swimming ). If you are a sports enthusiast or a gym enthusiast, GPED true wireless bluetooth earbuds will be the best choice for your family, lover, and friends!   Incredible Hi-Fi Stereo Sound GPED bluetooth earbuds with powerful A2DP/AVRCP audio processing system provides a rich and true-to-life audio, making you lose yourself in the immersive music. Due to the built-in Microphones design, this true wireless earbuds is perfect for hands-free calling, listening to music, chatting, running and so on.   Portable Charging Box Portable charging case is lightweight with large capacity lithium batteries, supporting 4 times fully charging to the wireless earbuds, letting you can get more than 5 hours of playtime after per charge. Meanwhile, the bluetooth headphones can also be automatically powered off and charged while putting back into the charging case!   Share Happiness with Your Friends This bluetooth wireless headphones adopts seperate earbuds design, you can share one earbuds with your friends, family or lover to share and record your happy moment. Meanwhile, the earbuds can be used individually, so you can connect 2 earbud with different cellphones by manual connection.   Q & A: How to pairing those two headsets?  Step 1. For initial use, press and hold the button for 3 seconds of either earbud and release after the LED flashes between Red and Blue. (Voice Notice: Power on - Paring) Step 2. Open the mobile phone bluetooth and search? Air Headset?, then connect it.  Step 3. Pairing the earphone with your mobile phone, the product will be in standby status after pairing completed, Blue LED flashes 5 seconds each time. (Voice Notice: Connected)   Please Note: 1.For incoming call, Press function button once to answer; Press function button twice to reject(When at the calling mode, only master earbud has sound, This safety feature allows you to hear the traffic While driving.) 2.If only one earbud has sound at music mode, please try to recover the default setting. 3.When you receive this package and use the Earbuds at the first time, the working time may not be very long, because we test them before sending them out, That costs some battery. Please don't worry. Charge them and they will work as expected.   Specifications: Color: Black, White Bluetooth Standard: Bluetooth V5.0+EDR Operation Range: 30 feet Talk Time: Up to 6 Hours Playing Time: Up to 3 Hours Charging Time: 1 Hour Battery Capacity: 100mAh   Package Included: 2 x Bluetooth Headset 2 x Ear Tips (S/M/L) 1 x Magnetic Charging Box 1 x USB Cable 1 x User Manual   【BLUETOOTH 5.0 & TWS】Compared with the previous bluetooth 4.2 bluetooth earbuds, GPED wireless headphones adopts most advanced bluetooth 5.0, supporting HSP, HFP, A2DP, AVRCP, you can get faster transmission speed and more stable connection without signal loss or music dropouts; The range is up to 33ft away, with built-in Mic, perfect for hands-free calling, sport, working or listen to music. 【ONE-STEP PAIRING】 - Easy to operate and fast to connect. Only need to take the earbuds out of the charging case, then they will be powered on and paired automatically, making you lose yourself in the immersive music. Meanwhile, the bluetooth headphones can also be automatically powered off and charged while putting back into the charging case. 【COMFORTABLE DESIGN & IP67 WATERPROOF】- This wireless bluetooth earbuds is very lightweight. Their ergonomic design provides a comfortable fit, reducing the pressure of the ear, so you won't feel uncomfortable even if you wear it long time; Thanks to the IP67 waterproof and sweatproof design, GPED bluetooth wireless earbuds will be your best choice for running, biking, learning, jogging, hiking, and gyms. 【20H PLAYTING TIME WITH CHARGING CASE】 - GPED true wirelss earbuds with portable charging case can charge up to 4 times for your headphones and easy to carry; Bluetooth V5.0 massively reduce the level of power consumption, so you can get more than 5 hours of playtime per charging. Never worry about no power when you are out due to the fast charging function(only takes 1.5 hours to fully charged). 【INDIVIDUAL USAGE BLUETOOTH EARPIECE】 - GPED bluetooth headset not only uses a separate headphones earbuds design, also can work as a individual use, so you can use a pair of earbuds with your family, friends and lovers to record your friendship, love, sharing your happy moment, is the most memorable gift. ","['【BLUETOOTH 5.0 & TWS】Compared with the previous bluetooth 4.2 bluetooth earbuds, GPED wireless headphones adopts most advanced bluetooth 5.0, supporting HSP, HFP, A2DP, AVRCP, you can get faster transmission speed and more stable connection without signal loss or music dropouts; The range is up to 33ft away, with built-in Mic, perfect for hands-free calling, sport, working or listen to music.', '【ONE-STEP PAIRING】 - Easy to operate and fast to connect. Only need to take the earbuds out of the charging case, then they will be powered on and paired automatically, making you lose yourself in the immersive music. Meanwhile, the bluetooth headphones can also be automatically powered off and charged while putting back into the charging case.', ""【COMFORTABLE DESIGN & IP67 WATERPROOF】- This wireless bluetooth earbuds is very lightweight. Their ergonomic design provides a comfortable fit, reducing the pressure of the ear, so you won't feel uncomfortable even if you wear it long time; Thanks to the IP67 waterproof and sweatproof design, GPED bluetooth wireless earbuds will be your best choice for running, biking, learning, jogging, hiking, and gyms."", '【20H PLAYTING TIME WITH CHARGING CASE】 - GPED true wirelss earbuds with portable charging case can charge up to 4 times for your headphones and easy to carry; Bluetooth V5.0 massively reduce the level of power consumption, so you can get more than 5 hours of playtime per charging. Never worry about no power when you are out due to the fast charging function(only takes 1.5 hours to fully charged).', '【INDIVIDUAL USAGE BLUETOOTH EARPIECE】 - GPED bluetooth headset not only uses a separate headphones earbuds design, also can work as a individual use, so you can use a pair of earbuds with your family, friends and lovers to record your friendship, love, sharing your happy moment, is the most memorable gift.']"
Skull Candy Jib W/mic Black/black,Walmart #  564871457,4.2,369 ratings,$9.88 ,"['Headphone Type', 'Wireless', 'Wireless Technology']","['In-Ear Headphones', 'N', 'None']","Jib earbuds with mic let you manage calls and music thanks to an inline microphone and remote with call, track, and volume controls. Quality ear gels create a noise isolating fit so your music stays in, and everything else stays out.  1. Supreme Sound?      2. Noise Isolating Fit      3. In-Line Microphone   ","['Specifications', 'Comparison Chart']"
"On Ear Headphones with Mic, Jelly Comb Foldable Corded Headphones Wired Headsets with Microphone, Volume Control for Cell Phone, Tablet, PC, Laptop, MP3/4, Video Game", ,4.2,268 ratings,$19.95 ,"['Headphone Type', 'Compatible Devices', 'Wireless Technology']","['On-Ear & Over-Ear', 'for Cell Phone, Tablet, PC, Laptop, MP3/4, Video Game', 'None']","? PREMIUM COMFORT ON-EAR HEADPHONES: Comfortable on-ear lightweight design along with soft ear cushions and adjustable padded headband provide premium comfort even during long listening sessions.? FOLDABLE AND PORTABLE HEADPHONES: Foldable design for portability makes the corded headphones easy to put into your package and take along anywhere. ? MULTI-FUNCTION IN-LINE CONTROL: The corded headphones features an in-line microphone for hands-free phone calls with one button control and one volume control. Adjust the volume to a comfortable level, easily control your music: Play, Pause, Previous, Next. ? STEREO BASS: Excellent rich & dynamic sound quality with bass response, delivering competitive acoustic performance with a unique look and feel.? UNIVERSAL COMPATIBILITY: Equipped with 46"" tangle-free cable, compatible with almost all 3.5mm jack audio devices: iPhone, iPad, iPod, Android cell phones, tablets, PC, laptops, Mac and more. The on-ear headphones with mic, designed with stretchable headband and soft leather earmuffs, fit perfectly and securely on your head, which you can wear all day without any discomfort. Unique in-line control design makes it easy to adjust the volume, enjoy music and chat with your friends. Stereo bass sound provides you the superior audio experience. Features:? Fashionable stylish sleek and trendy design.? Rich and dynamic sound with stereo bass.? Lightweight and foldable design for convenient storage and carrying. Flexible headband for easier sizing.? Minimize outside noise due to soft cushioned, pressure-relieving ear padding. ? 46 inches tangle-free cord with multi-function in-line control, adjust the volume at your fingertips, easily control your music with one button: pause, play, next song, previous song.? Built-in microphone makes hands-free talk at ease anytime.? Support all devices with a 3.5mm jack: Cellphones, tablets, PC, laptops, MP3/4, etc. Specifications:Frequency Response: 20-20KHzImpedance: 32ohm±15%Sensitivity: 103dB±15%Cable Length: 46 inchMicrophone: Built-inJack: 3.5mmPackage Included:1 x Headphones ","['? MULTI-FUNCTION IN-LINE CONTROL: The corded headphones features an in-line microphone for hands-free phone calls with one button control and one volume control. Adjust the volume to a comfortable level, easily control your music: Play, Pause, Previous, Next.', '? STEREO BASS: Excellent rich & dynamic sound quality with bass response, delivering competitive acoustic performance with a unique look and feel.? UNIVERSAL COMPATIBILITY: Equipped with 46"" tangle-free cable, compatible with almost all 3.5mm jack audio devices: iPhone, iPad, iPod, Android cell phones, tablets, PC, laptops, Mac and more.', 'The on-ear headphones with mic, designed with stretchable headband and soft leather earmuffs, fit perfectly and securely on your head, which you can wear all day without any discomfort. Unique in-line control design makes it easy to adjust the volume, enjoy music and chat with your friends. Stereo bass sound provides you the superior audio experience.', 'Features:? Fashionable stylish sleek and trendy design.? Rich and dynamic sound with stereo bass.? Lightweight and foldable design for convenient storage and carrying. Flexible headband for easier sizing.? Minimize outside noise due to soft cushioned, pressure-relieving ear padding.', '? 46 inches tangle-free cord with multi-function in-line control, adjust the volume at your fingertips, easily control your music with one button: pause, play, next song, previous song.? Built-in microphone makes hands-free talk at ease anytime.? Support all devices with a 3.5mm jack: Cellphones, tablets, PC, laptops, MP3/4, etc.', 'Specifications:Frequency Response: 20-20KHzImpedance: 32ohm±15%Sensitivity: 103dB±15%Cable Length: 46 inchMicrophone: Built-inJack: 3.5mmPackage Included:1 x Headphones']"
"JLab Audio JBuds Air True Wireless Signature Bluetooth Earbuds + Charging Case - IP55 Sweat Resistance - Bluetooth 5.0 Connection - 3 EQ Sound Settings: JLab Signature, Balanced, Bass Boost - Black",Walmart #  570332683,4,1198 ratings,$49.88 ,"['Headphone Type', 'Headphone Style', 'Wireless', 'Recommended Use', 'Compatible Devices', 'Wireless Technology']","['In-Ear Headphones', 'In-Ear', 'True Wireless', '1', 'iPhone, iPad, Galaxy, One, Surface, Android, iOS, Tablets, Mobile Devices', 'Bluetooth']","GO light as air. Time to GO on the move, in a pinch, out the door. Grab your JBuds Air True Wireless Earbuds as you head to work, get to the gym, or jump on an airplane. A 3-4-hour battery life with Bluetooth 5.0 gives you just enough power to get through those music moments. Their innovative charging case provides 10 extra hours to the earbuds so you can charge back up quickly. Automatically turning on and connecting to each other right out of the case, they provide hassle-free technology. Perfect for on-the-GO moments.Auto On & Playtime  JBuds Air automatically turn on and connect to each other once taken out of their charge case so you can keep going hassle-free. A Bluetooth 5.0 connection keeps you going for 3-4 hours in each earbud plus 7 extra hours of charge in the case.  *Since launch the JBuds Air have included Bluetooth 5. The package wasn't updated in time for the launch so note that your package may say Bluetooth 4.2. Enjoy the upgraded Bluetooth 5.   Custom EQ3 Sound  Choose the sound to match your personal preference between three options: Signature, Balanced, and Bass Boost modes ? without an app. Crystal clear sound, no matter what.   Control It All  Control all your music and volume with a tap or two on the outside of the earbud. Utilize the built-in microphone to activate Siri, Google Assistant, or take phone calls and keep GOing on the move.   Everyday Proof  An IP55 sweat resistance helps the earbuds hold up against moisture and dirt so you never have to worry during any hobby, travel, or workout.","['Walmart+', 'Grocery Pickup & Delivery', 'MoneyCenter', 'Walmart Credit Card', 'Walmart Pay', 'Weekly Ad', 'Other Services']"
Sony WH-CH510 Wireless On-Ear Headphones with Mic- Black,Walmart #  575975730,3.8,71 ratings,$49.88 ,"['Headphone Type', 'Wireless', 'Recommended Use', 'Compatible Devices', 'Wireless Technology']","['Wireless Headphones', 'Y', 'Portable electronics', '1', 'Bluetooth']","Get dynamic sound and all-day listening in a wireless headphone. The zero-compromise WH-CH510 wireless headphones feature an extra-long battery life of up to 35 hours. 30mm drivers bring crisp, clear sound, no matter what you're listening to. Make hands-free calls with the built-in microphone, and recharge with the updated USB-C connection. (This item has been discontinued by manufacturer, but is still available for purchase here) Listen all day long with up to 35 hours of playback time Listen to your favorite tracks wirelessly with a Bluetooth wireless technology by pairing your smartphone or tablet 30mm driver unit for dynamic sound Swivel design for easy travel Easy hands-free calling and voice assistant commands with microphone Voice assistant-compatible for easy access to your smartphone Next-generation USB Type C charging In the box: USB type-C Cable HEADPHONE TYPE -Closed Dynamic VOLUME CONTROL - Yes BATTERY CHARGE TIME - Approx. 4.5 hrs (Full charge) BATTERY LIFE (CONTINUOUS MUSIC PLAYBACK TIME) - Max. 35 h (fully charged) EFFECTIVE RANGE - Line of sight approx. 30 ft (10 m) Weight - 4.66 oz ","['Listen all day long with up to 35 hours of playback time', 'Listen to your favorite tracks wirelessly with a Bluetooth wireless technology by pairing your smartphone or tablet', '30mm driver unit for dynamic sound', 'Swivel design for easy travel', 'Easy hands-free calling and voice assistant commands with microphone', 'Voice assistant-compatible for easy access to your smartphone', 'Next-generation USB Type C charging', 'In the box: USB type-C Cable', 'HEADPHONE TYPE -Closed Dynamic', 'VOLUME CONTROL - Yes', 'BATTERY CHARGE TIME - Approx. 4.5 hrs (Full charge)', 'BATTERY LIFE (CONTINUOUS MUSIC PLAYBACK TIME) - Max. 35 h (fully charged)', 'EFFECTIVE RANGE - Line of sight approx. 30 ft (10 m)', 'Weight -\xa04.66 oz']"
Bose Noise Cancelling Wireless Headphones 700 with Google Assistant,Walmart #  575563048,4.7,230 ratings,$379.00 ,"['Headphone Type', 'Headphone Style', 'Wireless', 'Compatible Devices', 'Wireless Technology']","['On-Ear & Over-Ear', 'Over-Ear', 'Y', 'Bluetooth', 'Bluetooth']","Turn any space into the perfect place to listen to music, make phone calls, or get work done. Featuring powerful noise cancelling, astonishing sound, unrivaled voice pickup, and so much more, Bose Noise Cancelling Headphones 700 reinvent what headphones are and redefine what headphones can be. You can tap into the Google Assistant with the single touch of a button or access the world of Amazon just by saying, ""Alexa."" Prefer Siri? You can still access your phone's built-in voice assistant. The unrivaled microphone system in Bose Headphones 700 adapts to noisy and windy environments so your voice always sounds crystal clear on calls. Your voice sounds clear to your voice assistant, too, so your commands, voice-generated texts, and web searches are captured with unprecedented accuracy. When it comes to noise cancellation, Bose did more than improve the performance - they evolved how you use it. For example, if you're trying to focus in a busy cafe, you can maximize the noise cancelling to eliminate distractions. For times when you'd feel more comfortable hearing the world around you, like if you were walking down a congested city street, you can minimize the noise cancelling so you can hear more of what's going on around you. Fact is, you'll be able to hear the world around you so well, you'll be surprised you're wearing headphones at all. And for all the times where you'd prefer something between these two extremes, there are nine other levels to choose from. When you want to place a coffee order or speak to a coworker, use Conversation Mode. This handy new feature temporarily pauses your content, drops the noise cancelling down to zero, and lets you hear your surroundings for quick conversations. Don't forget about your music. Whether you're listening at low volumes or really want to turn it up, you'll get an immersive listening experience with signature active EQ. Bose Headphones 700 have a stunning new design that features a streamlined stainless-steel headband and a lightweight, comfortable fit for all-day listening. You can manage volume, calls, and music just by touching or swiping the earcup surface. The Bose Music app allows you to personalize your headphone settings so they perform exactly the way you want them to. It also ensures all your Bose smart products work together for a better listening experience. The headphones feature up to 20 hours of wireless battery life and time-based battery power information.   Turn any space into a workplace with powerful noise cancelling, astonishing sound, unrivaled voice pickup. Personalize your environment with 11 levels of noise cancelling - control distractions or let ambient sound in. The unrivaled microphone system isolates your voice so it sounds crystal clear absolutely anywhere. Manage volume, calls, and music just by touching and swiping the earcup surface. Get an immersive listening experience at any volume with signature active EQ. Pick the voice assistant that's right for you. Just press the dedicated VPA button for your Google Assistant - or say ""Alexa."" Or access your phone's native assistant, like Siri. Listen comfortably for hours with a sophisticated design that features a streamlined, lightweight stainless-steel headband and angled earcups for a perfect fit. Customize your controls to prioritize the functions you use most, like noise cancellation levels, voice levels, voice prompts, wake-up words, and more. Get more control from the Bose Music app, which ensures your Bose smart products work together for a more personal experience. Get up to 20 hours of wireless battery life and time-based power information. Bose Headphones 700 are carefully engineered to get better over time. Software updates will automatically add new features to enhance your listening experience.  ",[]
Skull Candy Jib Bluetooth Black,Walmart #  558246137,3.3,202 ratings,$9.99 ,"['Headphone Type', 'Wireless', 'Recommended Use', 'Compatible Devices', 'Wireless Technology']","['In-Ear Headphones', 'Y', '1', 'Multiplatform', 'Bluetooth']",Skullcandy Bluetooth Wireless Jib Bluetooth Wireless In-Ear Earbuds with Mic Black (S2DUW-K003),"['Specifications', 'Comparison Chart']"
JLab Audio Studio Wired On-Ear Headphones - Black,Walmart #  573111976,4.2,174 ratings,$19.88 ,"['Headphone Type', 'Headphone Style', 'Wireless', 'Recommended Use', 'Compatible Devices', 'Wireless Technology']","['On-Ear & Over-Ear', 'On-Ear', 'N', 'Portable electronics', '1', 'None']","Studio comfort, with studio sound. Plug in and GO anywhere with the Studio Headphones, the braided nylon cord is durable to use all day, everyday. C3 Sound delivers crystal, clear, clarity audio so your music sounds perfect every time you plug in. Fold the earcups in for compact size to fit in any bag. These are the perfect go-to headphone. Ultra-plush Faux Leather with Cloud Foam? cushions Tangle-free braided-nylon cord 40mm neodymium drivers with C3? Sound In-line microphone for calls, play/pause & track controls Compact, folding design ","['Ultra-plush Faux Leather with Cloud Foam? cushions', 'Tangle-free braided-nylon cord', '40mm neodymium drivers with C3? Sound', 'In-line microphone for calls, play/pause & track controls', 'Compact, folding design']"
Sony WFXB700 EXTRA BASS True Wireless Earbuds Bluetooth Technology - Black,Walmart #  578648480,3.9,45 ratings,$79.00 ,"['Headphone Type', 'Wireless', 'Recommended Use', 'Compatible Devices', 'Wireless Technology']","['Earbuds', 'Y', 'Portable electronics', 'Smartphone', 'Bluetooth']",Enjoy deep punchy EXTRA BASS sound in a truly wireless headphone. The WF-XB700 truly wireless headphones keep you going with up to 18 hours of battery life plus quick charging. The Ergonomic Tri-hold structure provides a secure fit and the IPX4 design gives you long-lasting sound through rain and sweat. Truly wireless design with BLUETOOTH wireless technology for total freedom EXTRA BASS for deep punchy sound Up to 9hr battery life total 18hr with charging case Easy and clear hands-free calling IPX4 water resistance against rain and sweat Ergonomic design for a secure comfortable fit Quickly access your smartphone’s voice assistant with a quick touch ,"['Truly wireless design with BLUETOOTH wireless technology for total freedom', 'EXTRA BASS for deep punchy sound', 'Up to 9hr battery life total 18hr with charging case', 'Easy and clear hands-free calling', 'IPX4 water resistance against rain and sweat', 'Ergonomic design for a secure comfortable fit', 'Quickly access your smartphone’s voice assistant with a quick touch']"
Beats Solo3 Wireless On-Ear Headphones with Apple W1 Headphone Chip - Black,Walmart #  577569880,4.3,72 ratings,$166.99 ,"['Headphone Type', 'Headphone Style', 'Wireless', 'Recommended Use', 'Wireless Technology']","['On-Ear & Over-Ear', 'On-Ear', 'Y', 'Portable electronics', 'Bluetooth']","Beats Solo3 Wireless on-ear headphones immerse you in rich, award-winning sound everywhere you want to go. With up to 40 hours of battery life, it's your perfect everyday headphone. The Apple W1 chip delivers one-touch pairing with your Apple devices and unique features like Siri integration. The headphone stays true to its predecessor with bold styling and streamlined design. And since it's durable, foldable, and wireless, Beats Solo3 Wireless is the ultimate portable listening device.Beats Solo3 Wireless Headphones:  Connect via Class 1 Bluetooth with your device for wireless listening The award-winning sound and design you've come to love from Beats Up to 40 hours of battery life for multi-day use With Fast Fuel, 5 minutes of charging gives you 3 hours of playback when battery is low Adjustable fit with comfort-cushioned ear cups made for everyday use Sleek, streamlined design that's durable and foldable to go everywhere you do Take calls, control your music and activate Siri with the multifunction on-ear controls Comes in Black, Red, Rose Gold, Satin Silver, and Satin Gold  What's in the Box:  Beats Solo3 wireless headphones Carrying case Universal USB charging cable (USB-A to USB Micro-B) Quick start guide Warranty card ","['Connect via Class 1 Bluetooth with your device for wireless listening', ""The award-winning sound and design you've come to love from Beats"", 'Up to 40 hours of battery life for multi-day use', 'With Fast Fuel, 5 minutes of charging gives you 3 hours of playback when battery is low', 'Adjustable fit with comfort-cushioned ear cups made for everyday use', ""Sleek, streamlined design that's durable and foldable to go everywhere you do"", 'Take calls, control your music and activate Siri with the multifunction on-ear controls', 'Comes in Black, Red, Rose Gold, Satin Silver, and Satin Gold']"
