name,wm_ID,rating,num_of_rating,price,feat_labels,feat_values,about_text,about_details
JLab Audio Studio Bluetooth Wireless On-Ear Headphones - Black,Walmart #  573570459,4,223 ratings,$29.83 ,"['Headphone Type', 'Headphone Style', 'Wireless', 'Recommended Use', 'Compatible Devices', 'Wireless Technology']","['On-Ear & Over-Ear', 'On-Ear|DJ', 'Y', 'Home Audio', 'Bluetooth Enabled Devices', 'Bluetooth']","Enjoy all-day comfort and crystal clear music with the JLab Audio Bluetooth Studio Wireless On-Ear Headphones. A long 30+ hour battery life with Bluetooth 5 keeps you going and jamming no matter where you are. Have full control over your music with the touch of a button while you hit the beach, travel, or just relax. Adjust the sound to your preference with EQ3 sound and choose between Signature, Balanced, and Bass Boost. Their ultra-plush Faux Leather and Cloud Foam ear cushions and headband provide a studio look and feel, and the universal microphone allows you to make phone calls while wearing the headphones. Revel in crystal clear sound and ultimate comfort with the JLab Audio Bluetooth Studio Wireless On-Ear Headphones. JLab Audio Bluetooth Studio Wireless On-Ear Headphones, Black:  30+ hour Bluetooth playtime Ultra-plush Faux Leather and Cloud Foam cushions EQ3 Sound Universal microphone allows you to make phone calls Convenient track and volume controls ","['30+ hour Bluetooth playtime', 'Ultra-plush Faux Leather and Cloud Foam cushions', 'EQ3 Sound', 'Universal microphone allows you to make phone calls', 'Convenient track and volume controls']"
Mini Wireless Earbuds Bluetooth 5.0 Earpiece Headphone - Noise Cancelling Sweatproof Headset with Microphone Built-in Mic and Portable Charging Case for iPhone Samsung Smartphones, ,4,473 ratings,$25.99 ,"['Headphone Type', 'Wireless', 'Compatible Devices', 'Wireless Technology']","['In-Ear Headphones', 'Y', 'Universal; Apple iPhone 8, 8+, x ,7, 7 Plus, 6S, 6S Plus, SE, 5S, 5C, 5; iPod; iPad; Samsung Galaxy; Note; Tab; Amazon Fire; Fire HD; Fire Kids; Dell; Google Nexus; OnePlus; Compatible with all Bluetooth-enabled devices (Bluetooth V2.1 and over)', 'Bluetooth']","Why choose Cshidworld E7 Bluetooth Earbuds?  -Truly Wireless Stereo Earphones, No-cable convoluted, enjoy walk and jog freely -Every earbud can be used as a bluetooth headphone alone.  -Lightweight and small. every earbud weights around 5.0g,wearing cozily -One Button design, one press to pair / play / answer / reject a phone call -Bluetooth V5.0 + Cvc6.0 -Support iOS and Andriod Battery Displaying -Compatible to most bluetooth-enabled devices   Specifications:  Bluetooth: Bluetooth 5.0 Operating Distance: Up to 10m/33ft.(open space)  Earphone Weight (single): 5.0g Charge Port: Micro USB  Package:  ? E7 Bluetooth Earbuds ? Micro USB Charging Cable ? Charge case(350 mAH)   REAL WIRELESS SEPARATE STEREO: Cshidworld TWS technology to make wireless synchronous connection stereo pairing come true. Without any cord troubles you can enjoy sports and music to the full. It has privacy call design, when you have hands-free calls only the main headphone (Left) can transfer voice signal. STORAGE BOX WITH CHARGING FUNCTION: equipped with mini and portable 450 mAh battery charging box, each ear plug 55 mAh, each earbud working time is 2 hours, two is 4 hours, the maximum volume of continuous call or listen to music for 2 hours to 4 hours, it is standby time of 120 hours. Do not worry about the lack of battery power, will not lose any call or stop music. MULTI-FUNCTIONS CONNECTIVITY: Twins mode: use 2 earbuds simultaneously, which means you can share the same music/movies with someone, and can enjoy the stereo sound by using both earbuds; Single mode: choose the right one or the left one, in single earbud mode, each bluetooth headset can connect with two Bluetooth devices like your iPhone or Android phone, iPad, tablet, or laptop; COMFORTABLE AND SECURE FIT:  designed base on thousands people's ear data, perfect angle and 3 sizes of ear cap, suit for most peoples? ear, enjoy most comfortable, fitting, stable wear experience. After-sales Guarantee One Month No Reason Money-Back Guarantee and 12 Months Replacement Warranty, If You Are Not Satisfied with Your Purchase for Any Reason, Please Feel Free To Contact Us at the Buyer Center or Support Email, 24/7 Quick Reply. ","['REAL WIRELESS SEPARATE STEREO: Cshidworld TWS technology to make wireless synchronous connection stereo pairing come true. Without any cord troubles you can enjoy sports and music to the full. It has privacy call design, when you have hands-free calls only the main headphone (Left) can transfer voice signal.', 'STORAGE BOX WITH CHARGING FUNCTION: equipped with mini and portable 450 mAh battery charging box, each ear plug 55 mAh, each earbud working time is 2 hours, two is 4 hours, the maximum volume of continuous call or listen to music for 2 hours to 4 hours, it is standby time\xa0of 120 hours. Do not worry about the lack of battery power, will not lose any call or stop music.', 'MULTI-FUNCTIONS CONNECTIVITY: Twins mode: use 2 earbuds simultaneously, which means you can share the same music/movies with someone, and can enjoy the stereo sound by using both earbuds; Single mode: choose the right one or the left one, in single earbud mode, each bluetooth headset can connect with two Bluetooth devices like your iPhone or Android phone, iPad, tablet, or laptop;', ""COMFORTABLE AND SECURE FIT:\xa0\xa0designed base on thousands people's ear data, perfect angle and 3 sizes of ear cap, suit for most peoples? ear, enjoy most comfortable, fitting, stable wear experience."", 'After-sales Guarantee One Month No Reason Money-Back Guarantee and 12 Months Replacement Warranty, If You Are Not Satisfied with Your Purchase for Any Reason, Please Feel Free To Contact Us at the Buyer Center or Support Email, 24/7 Quick Reply.']"
JLab Audio JBuds Air Executive True Wireless Bluetooth Earbuds + Charging Case - Black - **Updated November 2019!,Walmart #  575963800,3.8,170 ratings,$69.88 ,"['Headphone Type', 'Headphone Style', 'Wireless', 'Recommended Use', 'Compatible Devices', 'Wireless Technology']","['In-Ear Headphones', 'In-Ear|Sport', 'Y', 'Portable electronics', 'iPhone, iPad, Galaxy, One, Surface, Android, iOS, Tablets, Mobile Devices', 'Bluetooth']","Updated November 2019: Improved Bluetooth 5.0 Chipset with enhanced connection and ceramic antenna technology.   Updated November 2019: Reengineered touch sensors provide an even more fluid user experience with touch gestures improved on all controls.   GO Lead.  The JBuds Air Executive keep you GOing for travel and business, with 30+ hours of playtime and dual microphones providing a crystal-clear listening experience for both phone calls and music. From the office to the airport, a 6-hour battery life in each earbud and 24+ extra hours in the case provide all day listening. An ergonomic design plus included Cloud Foam? eartips keep the earbuds comfortable for long days and an IP55 sweat resistance offer the durability you need wherever you go. You can even adjust your sound with our C3 Sound technology, allowing you to choose between three EQ settings; Signature, Balanced, and Bass Boost.   Long Travel Playtime  The earbuds hold a 6-hour battery life and the compact case provides 24+ additional hours of playtime. The JBuds Air Executive automatically start charging when placed in the case, which recharges with the integrated patent-pending USB cable.   C3 Calling  The JBuds Air Executive feature stereo audio and C3 (crystal clear clarity) phone calls from upgraded dual microphones. One mic picks up and eliminates surrounding noise while the other picks up your voice for clear conversations anywhere, anytime.   Auto On & Connect  The earbuds will automatically turn on and connect to each other right out of the case, as well as instant connect to your phone. Utilizing Bluetooth 5, this is our fastest hands-free connection yet.   Control It All  Featuring touch sensors to control all your music and phone calls with just a tap or hold, it?s easy on-the-GO. Turn on or off Be Aware Audio to let ambient noise in for safe listening or zone out to just your music.   Cloud Foam Comfort  Enjoy endless comfort while traveling with the included Cloud Foam? Eartips that mold perfectly in place. Trust the JBuds Air Executive?s durability with an IP55 water and dust resistance. JLab Audio JBuds Air Executive True Wireless Bluetooth Earbuds + Charging Case - Black - C3 Calling with Dual Microphones - Long Travel Playtime - Bluetooth 5.0 Connection - 3 EQ Sound Settings",['360° rotation']
"JLab Audio JBuddies Studio Volume Safe, Folding, Over-ear Kids Headphones with Mic - Graphite/Purple",Walmart #  573112436,4.5,108 ratings,$14.88 ,"['Headphone Type', 'Wireless', 'Recommended Use', 'Compatible Devices', 'Wireless Technology']","['On-Ear & Over-Ear', 'N', '1', '1', 'None']","FITS AGES 6 YEARS OLD AND UP. LIFETIME WARRANTY. ***The Wirecutter's corded headphone pick for older kids and safe listening*** Comfort for home or school. Style to suit any teen. JLab's Over-Ear Cloud Foam cushions offer ultimate comfort for homework session focus? without the rock-star price tag. The smooth-sliding metal adjustments and feather-light build give the long-lasting, all-day comfort kids require. Not to mention they're tested and approved for safe listening for kids with their built in volume-limiter at 85db. OVER EAR COMFORT Over Ear design with comfy Eco Leather? Cushions and padded headband offer all-day comfort for all ages, from grade school tykes to teens. VOLUME SAFE What would great style be without performance? The JBuddies offer safe-volume control, with built-in volume regulators, to ensure kids never rock out past 85db. And each pair is still designed with JLab's high-performance sound standards in mind. ADJUST AND FOLD Whenever, Wherever: Hook up the tangle free, braided-nylon cord equipped with an in-line mic for taking calls, firing up your tunes, pausing them and controlling the tracks on your mix. The 90 degree jack rocks with all devices and cases. And the compact, adjustable headband fits growing kids from ages 6-16. MUSIC TO-GO Built for everyone who loves to rock n? roll, the smooth-sliding metal adjustments and feather-light build are ready to hit the road. The plush circular ear cups rotate 80 degrees and fold up in the palm of your hand so you can bring them wherever life takes you, on or off tour. Compact, adjustable headband fits growing kids from ages 6-16.JLab Audio JBuddies Studio Volume Safe, Folding, Over-ear Kids Headphones with Mic - Graphite/Purple","['Walmart+', 'Grocery Pickup & Delivery', 'MoneyCenter', 'Walmart Credit Card', 'Walmart Pay', 'Weekly Ad', 'Other Services']"
Skullcandy Hesh 2 Wireless Bluetooth Headphone,Walmart #  554453508,4.1,170 ratings,$64.90 ,"['Headphone Type', 'Wireless', 'Recommended Use', 'Compatible Devices', 'Wireless Technology']","['Wireless Headphones', 'Y', '1', '1', 'Bluetooth']","Get crystal-clear sound and more with Skullcandy Hesh 2 Wireless Bluetooth Headphone. These lightweight headphones are designed for superior performance, with a new, streamlined, sleek profile for a subtle touch of style. The Skullcandy Bluetooth headphones deliver high-quality sound with proprietary Supreme Sound technology. They're compatible with any Bluetooth-enabled device for effortless use with iPhones and Android smartphones, MP3 players, computers, stereos and more. Wireless functionality and a built-in rechargeable battery make it easy to listen to music, audiobooks, podcasts and more for up to 15 hours. They can be easily converted to wired headphones with an included backup cable. Handy onboard controls to allow you to answer phone calls or change the music with just a touch. A flexible, ultra-durable headband and plush, synthetic leather ear pads allow for a more comfortable wearing experience. A travel bag is included for easy storage.Skullcandy Hesh 2 Wireless Bluetooth Headphone:  Compatible with any Bluetooth-enabled device Skullcandy headphone with Supreme Sound technology Up to 15 hours play time on built-in rechargeable battery Wired listening with included backup cable On-board controls for phone calls and music Skullcandy Bluetooth headphone can be used with iPhones, MP3 players, computers, stereos and more 50mm drivers for superior performance and crystal-clear sound Plush, synthetic leather ear pads for a more comfortable experience Flexible, ultra-durable headband for comfortable wear and lasting, reliable performance Solid black color  Over-ear style Travel bag included for effortless portability and easy storage ","['Compatible with any Bluetooth-enabled device', 'Skullcandy headphone with Supreme Sound technology', 'Up to 15 hours play time on built-in rechargeable battery', 'Wired listening with included backup cable', 'On-board controls for phone calls and music', 'Skullcandy Bluetooth headphone can be used with iPhones, MP3 players, computers, stereos and more', '50mm drivers for superior performance and crystal-clear sound', 'Plush, synthetic leather ear pads for a more comfortable experience', 'Flexible, ultra-durable headband for comfortable wear and lasting, reliable performance', 'Solid black color ', 'Over-ear style', 'Travel bag included for effortless portability and easy storage']"
Bose Noise Cancelling Wireless Headphones 700 with Google Assistant,Walmart #  575563048,4.7,230 ratings,$379.00 ,"['Headphone Type', 'Headphone Style', 'Wireless', 'Compatible Devices', 'Wireless Technology']","['On-Ear & Over-Ear', 'Over-Ear', 'Y', 'Bluetooth', 'Bluetooth']","Turn any space into the perfect place to listen to music, make phone calls, or get work done. Featuring powerful noise cancelling, astonishing sound, unrivaled voice pickup, and so much more, Bose Noise Cancelling Headphones 700 reinvent what headphones are and redefine what headphones can be. You can tap into the Google Assistant with the single touch of a button or access the world of Amazon just by saying, ""Alexa."" Prefer Siri? You can still access your phone's built-in voice assistant. The unrivaled microphone system in Bose Headphones 700 adapts to noisy and windy environments so your voice always sounds crystal clear on calls. Your voice sounds clear to your voice assistant, too, so your commands, voice-generated texts, and web searches are captured with unprecedented accuracy. When it comes to noise cancellation, Bose did more than improve the performance - they evolved how you use it. For example, if you're trying to focus in a busy cafe, you can maximize the noise cancelling to eliminate distractions. For times when you'd feel more comfortable hearing the world around you, like if you were walking down a congested city street, you can minimize the noise cancelling so you can hear more of what's going on around you. Fact is, you'll be able to hear the world around you so well, you'll be surprised you're wearing headphones at all. And for all the times where you'd prefer something between these two extremes, there are nine other levels to choose from. When you want to place a coffee order or speak to a coworker, use Conversation Mode. This handy new feature temporarily pauses your content, drops the noise cancelling down to zero, and lets you hear your surroundings for quick conversations. Don't forget about your music. Whether you're listening at low volumes or really want to turn it up, you'll get an immersive listening experience with signature active EQ. Bose Headphones 700 have a stunning new design that features a streamlined stainless-steel headband and a lightweight, comfortable fit for all-day listening. You can manage volume, calls, and music just by touching or swiping the earcup surface. The Bose Music app allows you to personalize your headphone settings so they perform exactly the way you want them to. It also ensures all your Bose smart products work together for a better listening experience. The headphones feature up to 20 hours of wireless battery life and time-based battery power information.   Turn any space into a workplace with powerful noise cancelling, astonishing sound, unrivaled voice pickup. Personalize your environment with 11 levels of noise cancelling - control distractions or let ambient sound in. The unrivaled microphone system isolates your voice so it sounds crystal clear absolutely anywhere. Manage volume, calls, and music just by touching and swiping the earcup surface. Get an immersive listening experience at any volume with signature active EQ. Pick the voice assistant that's right for you. Just press the dedicated VPA button for your Google Assistant - or say ""Alexa."" Or access your phone's native assistant, like Siri. Listen comfortably for hours with a sophisticated design that features a streamlined, lightweight stainless-steel headband and angled earcups for a perfect fit. Customize your controls to prioritize the functions you use most, like noise cancellation levels, voice levels, voice prompts, wake-up words, and more. Get more control from the Bose Music app, which ensures your Bose smart products work together for a more personal experience. Get up to 20 hours of wireless battery life and time-based power information. Bose Headphones 700 are carefully engineered to get better over time. Software updates will automatically add new features to enhance your listening experience.  ",[]
Skull Candy Jib Bluetooth Black,Walmart #  558246137,3.3,202 ratings,$9.99 ,"['Headphone Type', 'Wireless', 'Recommended Use', 'Compatible Devices', 'Wireless Technology']","['In-Ear Headphones', 'Y', '1', 'Multiplatform', 'Bluetooth']",Skullcandy Bluetooth Wireless Jib Bluetooth Wireless In-Ear Earbuds with Mic Black (S2DUW-K003),"['Specifications', 'Comparison Chart']"
Skullcandy Indy™ XT Evo,Walmart #  578713283,4,409 ratings,$69.00 ,"['Headphone Style', 'Wireless', 'Wireless Technology']","['Wireless Earbuds', 'Y', 'Bluetooth']","SET YOURSELF WIRELESS. True wireless means no wires. And no wires mean no snagging, yanking or tangling. Plus, with Indy™ XT Evo, the case and buds hold up to 30 hours of total play time, and either bud can take calls or activate your assistant. CONTROL WITHOUT YOUR PHONE. A simple series of touches control everything directly from your buds. Answer calls, skip tracks, adjust volume, activate an assistant, switch EQ modes, even turn on Ambient Mode to hear more of your surroundings—all without ever touching your device. NEVER LOST WITH TILE. Built-in Tile technology makes it easy to track down either earbud if you ever misplace them (Tile app required). DURABLE AND REPLACEABLE. Indy™ XT Evo earbuds are resistant to water, sweat and dust. And just in case any part is lost or damaged, our Fearless Use Promise means we’ll replace it at a discount.• True Wireless via Bluetooth® 5• Up to 30 Hours Total Battery Life• 6 Hours in Ear Buds, 24 Hours in Charging Case• Rapid Charge in Both Earbuds and Charging Case: 10 Minutes Ear Bud Charging = 2 Hours of Playtime. 10 Minutes of Case Charging = 2 Hours of Playtime• Enhanced Fit and Size• IP55 Sweat, Water, and Dust Resistant Earbuds• Call, Track, and Volume Control• Activate Assistant• Touch Controls• Noise Isolating Fit• Single Bud Use (Both Sides)• Track and Find if Lost via Tile®• Multiple EQ Modes: Music, Movie, and Podcast• Ambient Listening Mode• USB-C Charging Cable• Fearless Use Promise• 2-Year Warranty","['Walmart+', 'Grocery Pickup & Delivery', 'MoneyCenter', 'Walmart Credit Card', 'Walmart Pay', 'Weekly Ad', 'Other Services']"
"True Wireless Earbuds, Bluetooth 5.0 Noise Canceling Stereo Earphones X8S In-Ear Wireless Headphones with Charging Case", ,4.1,63 ratings,$18.69 ,"['Headphone Type', 'Headphone Style', 'Wireless', 'Wireless Technology']","['In-Ear Headphones', 'In-Ear', 'Y', 'Bluetooth']"," Mini True Wireless Earbuds, Bluetooth 5.0 Noise Canceling Stereo Headset X8S In-Ear Wireless Headphones with Charging Case   Description    True wireless Bluetooth headset with touch function, easy to use.  Mini compact, comfortable to wear.  High grade chip, the transmission is faster and more stable.  High-definition microphone, bilateral call, CVC noise canceling technology, clearer call.  With charging case 2200mah, can be used as power bank,can charge your mobile phone.   Ergonomic design, does not hurt when wear for long time.  10 meters barrier-free transmission, mobile phone away from the hand, music with you.  Function: music switch, call, 5D stereo, answer/reject, on/off, play/pause, volume +/-, Siri control, one drag to two, power display, voice prompt, NFC function, etc.  Compatible: Android, iPhone IOS 5.0 above bluetooth devices. Specification:    Binaural Earphone with battery  Mode: TWS-X8S  Bluetooth: 5.0  Support: Auto start, Auto pairing, Waterproof  Noise cancelling: CVC 8.0  Charging times: 35 times  Working distance: 10m  Earbuds capacity (single): 50mAh  Charging box capacity: 3000mAh  Music time: about 220 hours  Talk time: about 300 hours Package Included:  1 Pair Bluetooth Earbuds1 x Charging Box1 x Charging Cable1 x User Manual True Wireless Bluetooth Headset with Touch Function Advanced Bluetooth 5.0 Noise Cancelling & Good Sound Quality Sweatproof & Comfortable ","['True Wireless Bluetooth Headset with Touch Function', 'Advanced Bluetooth 5.0', 'Noise Cancelling & Good Sound Quality', 'Sweatproof & Comfortable']"
Bose SoundSport Wireless Sports Earbuds - Black,Walmart #  565783097,4.4,372 ratings,$129.00 ,"['Headphone Type', 'Headphone Style', 'Wireless', 'Recommended Use', 'Compatible Devices', 'Wireless Technology']","['In-Ear Headphones', 'Sport', 'Y', 'Portable electronics', 'Bluetooth Enabled Device', 'Bluetooth']","Bose SoundSport Wireless Sports Earbuds are In-ear wireless headphones designed for rigorous workouts with StayHear+ earbud tips for comfort and a secure fit. They're sweat, weather and water resistant to fit your active lifestyle. Wireless Connectivity: Bluetooth and NFC pairing connects your devices wirelessly. Volume-optimized EQ gives you balanced audio performance at any volume. Easy Headphone Controls with an inline mic and remote lets you conveniently control volume, skip tracks and take calls, all without reaching for your device. Lithium-ion battery delivers up to 6 hours per charge. The Bose Connect app makes controlling and switching between multiple devices easy, and continually adds more functionality to your headphones.   Sweat and water-resistant earbuds for rigorous workouts StayHear+ earbud tips designed for comfort and stability Bluetooth pairing so you can connect to your devices wirelessly Long life battery delivers up to 6 hours per charge An inline mic and remote lets you easily control volume, skip tracks and take calls, all without reaching for your device Volume-optimized EQ gives you balanced audio performance at any volume The Bose Connect app makes controlling and switching between multiple devices easy Available in Black, Aqua or Citron      ","['Sweat and water-resistant earbuds for rigorous workouts', 'StayHear+ earbud tips designed for comfort and stability', 'Bluetooth pairing so you can connect to your devices wirelessly', 'Long life battery delivers up to 6 hours per charge', 'An inline mic and remote lets you easily control volume, skip tracks and take calls, all without reaching for your device', 'Volume-optimized EQ gives you balanced audio performance at any volume', 'The Bose Connect app makes controlling and switching between multiple devices easy', 'Available in Black, Aqua or Citron']"
"JLab Audio JBuds Pro Premium in-ear Earbuds with Mic, Guaranteed Fit, GUARANTEED FOR LIFE - Black",Walmart #  556561360,4.6,845 ratings,$21.05 ,"['Headphone Type', 'Wireless', 'Wireless Technology']","['In-Ear Headphones', '@generated', 'None']","JBuds Pro Signature Earbuds  For some, the next level of refinement is not only appreciated, but required. Treat yourself to the JBuds Pro earbuds ? the perfect complement to our all-new JBuds2 earphones.  Accept the premium JBuds Pro earbuds as the show piece of your Instagram-famous lifestyle. They not only belong, but offer the veracious balance between performance, cost and damn good looks.  But it?s not all flash. The JBuds Pro bring more comfort. And an even better fit. We?ve paired this boss with Adjustable Tip Placement (ATP), Cush Fin Technology and a whole crew of gel tips. Find that perfect all-day fit.  Design dominance  An ultra lightweight design with improved ergonomic shape offer everyday comfort. Soft gel tips in small, medium and large sizes provide a super comfortable, noise reducing fit.An ultra lightweight design, with improved ergonomic shape, offers next-level comfort. The ergonomic earbud shape maximizes natural comfort with a 45-degree angle that provides a comfortable, noise-reducing fit that dominates the imitators.Premium sound quality, compact size and sleek design with ATP3 soft silicone gel tips provide a super comfortable, noise-reducing fit; select from small, medium and large sizes2 Cush Fins guarantee a perfect fitHigh-intensity listening experience with crisp, clear sound and deep bass","['Specifications', 'Comparison Chart']"
