name,wm_ID,rating,num_of_rating,price,feat_labels,feat_values,about_text,about_details
Wireless Bluetooth 5.0 Earbuds IPX7 Waterproof Headphones Noise Canceling Earphones Wireless in-Ear Earpiece 35H Playtime HiFi 3D Stereo Sound Headset Built-in Mic & Charging Case for Work Sports, ,4.1,81 ratings,$19.99 ,"['Headphone Type', 'Wireless', 'Wireless Technology']","['In-Ear Headphones', 'Y', 'Bluetooth']","True Wireless Earbuds Bring you exceptional music enjoyment & true wireless freedom   Immersive Sound & Superior Calls Put Cshidworld wireless earbuds in your ears, indulge yourself in the world of incredible music with exceptional accuracy& clarity. Also, Bluetooth earbuds with cVc 8th noise cancellation technology always makes your voice sound clear on the call no matter how noisy the environment is, so no need to worry about affecting the quality of an important call when you are outside.   IPX7 Waterproof Keep playing, running, and dancing in any conditions. Cshidworld wireless earbuds effortlessly resist sweat and rain, and can even be rinsed clean under the tap. Great for gym, running and yoga.   Ultra-long Battery Life Up to 6 hours playtime on a single charge. With charging case supplies 6 times recharge, total up to 42 hours battery life.   One-Step Pairing Just pick up 2 headsets from charging box They will connect each other automatically,Powerful Bluetooth 5.0 chip that perfectly matches tablets, laptops, iOS, and Android smartphones.   Package Include: 1 * Bluetooth Earbuds 1 * Charging case 1 * USB Cable 1 * 3 pair silicone cases(S,M,L) 1 * Manual  Bluetooth 5.0 & One-Step Pairing: The latest Bluetooth 5.0 with TWS technology on both bluetooth earbuds, provides faster pairing, stable connection and signal transmission (50ft no-obstacle range). Just pick up 2 headsets from charging box They will connect each other automatically,Powerful Bluetooth 5.0 chip that perfectly matches tablets, laptops, iOS, and Android smartphones. IPX7 Waterproof: Wireless earbuds Certificated with IPX7 waterproof,Say Goodbye to Water-Damage! Protected by Liquipel Nano Coating your earbuds withstand sweaty workouts and will survive accidental dropping into water, this makes the headphones great for outdoor sports and long trainings. Superior Stereo Sound & Long Battery Life: Equipped the latest moving-coil Horn loudspeaker with bigger dynamic driver, it has Hi-Fi sound quality, Deep bass and 3D surround stereo, feel like you are listening the concert on the scene, providing a reality sound for you. Single charging can maintain earbuds working 6 hours. The Charging Case provides 6 times charging for earbuds, totally 42 hours working time. You could charge your earbuds whenever and wherever you want. Hi-Fi Stereo Sound & Noise Cancellation: The sound inside the Bluetooth headphones ensures a true audiophile experience, impeccable music quality and clear in-ear call with signal range up to 50ft. Latest noise cancellation technology will let you enjoy your music moment even in a loud environment. Ergonomic Design: Wireless bluetooth earbuds are designed to comfortably fit in your ear. Suitable for almost everyone's ears.Ergonomic and lightweight design fit comfortably and snuggly in your ear; 3 sizes of ear tips option provide individualized fit and comfort for all-day wearing with no pain; they fit securely, stay firm in place even for workout or running. ","['Bluetooth 5.0 & One-Step Pairing: The latest Bluetooth 5.0 with TWS technology on both bluetooth earbuds, provides faster pairing, stable connection and signal transmission (50ft no-obstacle range). Just pick up 2 headsets from charging box They will connect each other automatically,Powerful Bluetooth 5.0 chip that perfectly matches tablets, laptops, iOS, and Android smartphones.', 'IPX7 Waterproof: Wireless earbuds Certificated with IPX7 waterproof,Say Goodbye to Water-Damage! Protected by Liquipel Nano Coating your earbuds withstand sweaty workouts and will survive accidental dropping into water, this makes the headphones great for outdoor sports and long trainings.', 'Superior Stereo Sound & Long Battery Life: Equipped the latest moving-coil Horn loudspeaker with bigger dynamic driver, it has Hi-Fi sound quality, Deep bass and 3D surround stereo, feel like you are listening the concert on the scene, providing a reality sound for you. Single charging can maintain earbuds working 6 hours. The Charging Case provides 6 times charging for earbuds, totally 42 hours working time. You could charge your earbuds whenever and wherever you want.', 'Hi-Fi Stereo Sound & Noise Cancellation: The sound inside the Bluetooth headphones ensures a true audiophile experience, impeccable music quality and clear in-ear call with signal range up to 50ft. Latest noise cancellation technology will let you enjoy your music moment even in a loud environment.', ""Ergonomic Design: Wireless bluetooth earbuds are designed to comfortably fit in your ear. Suitable for almost everyone's ears.Ergonomic and lightweight design fit comfortably and snuggly in your ear; 3 sizes of ear tips option provide individualized fit and comfort for all-day wearing with no pain; they fit securely, stay firm in place even for workout or running.""]"
Life Note TWS In Ear Headphones (A3908-White),Walmart #  575873330,4.1,40 ratings,$49.00 ,"['Headphone Type', 'Wireless', 'Wireless Technology']","['In-Ear Headphones', 'Y', 'Bluetooth']","ANKER Soundcore Life Note TWS In-Ear Headphones, Graphene-enhanced Sound, pioneering audio technology delivers highly accurate sound with superior clarity. Crystal-Clear Call via Dual Mic Noise Cancellation, featured 2-mic uplink noise cancelling technology to optimize your voice and minimize background noise.,IPX5 Waterproof, 40 hrs playtime for a whole day use, up to 40hrs playtime with the charging case, and up to 5 hrs with single charge,PUSH AND GO?,Effortless Setup Up to 40 Hours of Playtime: Enjoy 7 hours of playtime on a single charge and extend to 40 hours with the charging case.    Crystal-Clear Calls: 4 microphones with the latest cVc noise reduction technology highlight your voice while reducing background sounds.    Expertly Tuned Sound: Graphene drivers produce a wider soundstage with exceptional accuracy and clarity.   BassUp Technology: Exclusive technology conducts real-time analysis and enhancement of your audio's bass frequencies to add powerful sonic punch.     aptX Technology: Your music is transferred at the highest possible quality to preserve the sound and give you an exceptional listening experience with CD-like audio quality.     Water-Resistant Casing: Life Note?s IPX5-rated protection defends your earbuds against liquid damage.     One-Step Pairing: Life Note wireless earphones use our PUSH AND GO technology to automatically connect with the last paired device.    Comfortable Fit: Select from a range of EarTips in multiple sizes to find the perfect fit for your ears.     USB-C Charging: Charge Life Note?s charging case using the included USB-C cable.      Bluetooth 5: An ultra-stable connection between the wireless earphones and your device ensures skip-free streaming of music, podcasts, and more.     Mono or Stereo: Effortlessly switch between using a single earbud or both."" ",['Up to 40 Hours of Playtime: Enjoy 7 hours of playtime on a single charge and extend to 40 hours with the charging case.']
"TREBLAB XR100 Bluetooth Sports Headphones, Wireless Earbuds for Running Workout Secure Fit Earhooks, Noise Cancelling Sweatproof Cordless Headset for Gym Use, Earphones w/Mic, iPhone Android (White)", ,4.5,582 ratings,$23.97 ,"['Headphone Type', 'Headphone Style', 'Compatible Devices', 'Wireless Technology']","['In-Ear Headphones', 'Over-Ear; In-Ear', 'iPhone X', 'Bluetooth']","Hello, we are TREBLAB and we LOVE SOUND. We got tired of wasting money on hyped up, overpriced or subpar earbuds and so we set out to build Bluetooth headphones for those who see through the hype and really want results in fitness and sport. Each TREBLAB product is manufactured with precision and care, and every detail is designed for maximum music enjoyment. Join us in hacking through the hype and experience the truly pure sound of TREBLAB. TREBLAB XR100 portable wireless sports headphones The moment you put on small,mini earbuds by TREBLAB, you will be treated to true stereo HD sound with unparalleled bass and treble response with advanced noise isolation. With seamless wireless Bluetooth connectivity from Android to iPhone, long battery life, water resistance IPX4, sweat proof and more, as you will see that TREBLAB XR100 wireless Bluetooth headphones really are the earbuds choice for your cell phone, iPad, iPhone or computer. Product features: - HIGH-QUALITY BASS SOUND - wireless workout headphones with rock-solid bass and crisp treble. - PASSIVE NOISE CANCELLATION - noise canceling Bluetooth earbuds with expandable foam ear-tips. - SECURE COMFORT FIT - soft rubber ear tips and ear hooks, secure the cord behind the neck. - LONG BATTERY LIFE - Bluetooth earphones for sport, motorcycle, yoga, gym or athletic exercising with up to an incredible 8 HOURS of playtime. - CALLS CONTROL - cordless headphones come with HD Microphone for easy hands free calling and talking on the phone, volume control, skip, pause and play buttons. - UNIVERSAL COMPATIBILITY - these wireless headphones for running are compatible with all Bluetooth devices. We care about our reputation and your satisfaction, making all our products for people who see through the hype. What is more, we offer you a 1-Year Warranty & 30-Day Returns to make this a zero-risk purchase. In case you need our assistance, our friendly Customer Care is 7 days a week at your service. TECHNICAL SPECIFICATIONS:  Playtime: up to 8 hours Charging time: up to 2 hours Battery capacity: 100 mAh Bluetooth 4.1 Signal range: 33 feet / 10 meters Passive Noise-Cancellation, cVc 6.0 Driver diameter: 11mm Water-resistant IPX4 Phone calls with built-in microphone Multipoint connection Frequency response: 20Hz - 20kHz On device control with multi-functional buttons Volume control Headphones Dimensions: 35 x 30 x 15 mm / 1.37 x 1.18 x 0.6 in Headphones Weight: 22 g / 0.77 oz / 0.05 lb Color: White  IN THE BOX:  TREBLAB XR100 Earbuds 3 sizes of Silicone Eartips 3 sizes of Expandable Foam Eartips TREBLAB XR100 Carrying case Cable Clip USB/Micro USB Charging cable TREBLAB XR100 User Manual  Manufacturer reserves the right to change the package contents along with the product upgrade.Due to this, you may come across customers' photo/video reviews showing products/accessories that have been already upgraded or no longer included in the package. To learn the actual information regarding the package contents, please check IN THE BOX section. Check out TREBLAB XR100 key features below: Wireless Bluetooth earbuds for sports, running or gym workout Up to 8 hours of playtime from a 2-hour charge Compatible with all Android and iOS devices Water resistant IPX4, sweat proof sports headphones Built in microphone for calling Passive noise cancellation Secure, comfortable fit with soft, rubber ear hooks Carrying case, cord minder, 3 sizes of both foam and silicone eartips ","['Playtime: up to 8 hours', 'Charging time: up to 2 hours', 'Battery capacity: 100 mAh', 'Bluetooth 4.1', 'Signal range: 33 feet / 10 meters', 'Passive Noise-Cancellation, cVc 6.0', 'Driver diameter: 11mm', 'Water-resistant IPX4', 'Phone calls with built-in microphone', 'Multipoint connection', 'Frequency response: 20Hz - 20kHz', 'On device control with multi-functional buttons', 'Volume control', 'Headphones Dimensions: 35 x 30 x 15 mm / 1.37 x 1.18 x 0.6 in', 'Headphones Weight: 22 g / 0.77 oz / 0.05 lb', 'Color: White']"
Refurbished Apple AirPods Generation 2 with Wireless Charging Case MRXJ2AM/A,Walmart #  577621598,4.5,33 ratings,$119.00 ,"['Headphone Type', 'Wireless', 'Wireless Technology']","['In-Ear Headphones', 'Y', 'Bluetooth']","*This item is REFURBISHED. The new AirPods combine intelligent design with breakthrough technology and crystal clear sound. Powered by the new Apple H1 headphone chip, AirPods now feature hands-free access to Siri using just your voice. And up to 3 hours of talk time on a single charge.Apple Airpods Generation 2 With Wireless","['Walmart+', 'Grocery Pickup & Delivery', 'MoneyCenter', 'Walmart Credit Card', 'Walmart Pay', 'Weekly Ad', 'Other Services']"
"Wireless Earbuds, ABLEGRID Bluetooth 5.0 TWS True Wireless Headphones with 400mAh Charging Box Hi-Fi Noise Cancellation Bluetooth Headphones Sweat Proof Bluetooth Earbuds with Mic for Workout Driving", ,4,44 ratings,$22.99 ,"['Headphone Type', 'Wireless', 'Wireless Technology']","['In-Ear Headphones', 'Y', '4G']","Why ABLEGRID Pyxis II Earbuds?ABLEGRID is a professional manufacturer that dedicated to the research of earphone audio,we constantly research the functions of earphones, and strive to provide customers with the best earphones. Our main headphones include active noise cancelling headphones, hanging neck headphones, sports headphones etc.   Pyxis II Earbuds Features:- TWS ture wireless stereo earbuds wtih CVC 6.0 microphone for clear hands free calls. - 10mm dynamic driver and Airoha AB1532 chipset delivers premium audio and punchy, deep bass. - Bluetooth 5.0 technology for steady connection within 33ft (10M). - Touch control: Play/pause music, previous/next song, answer/hang up/reject call, siri voice assistant. - 25H playtime: With charging case, only 1.5h for fully charge. Can provide 3-4 times charge for earbuds. - IPX5 waterproof, suitable for indoor/outdoor sports, such as workout, yoga, running, cycling.   Warm Tips1.Please take off the headphone every 1-2 hrs to get your ears relax, get better hearing enjoyment and keep the head comfortable. 2.If you forgot to bring charging cabin when going out, you could easily switch on earbuds by press both sides of earbuds for 3s while switch them off by press 8s.  FAQsQ1: The earbuds didn’t turn on automatically when taking out of charging cabin A1: Please check the power of charging cabin. If the power is run out, the earbuds couldn’t turn on automatically. If so, you could turn it on through manual method. (Press the earbuds for 3s)  Q2: Do the earbuds stay in the ears if we are sweaty? I have had a few pairs fallen out while i’m exercising. A2: Make sure that you wear the earbuds correctly (see user manual page 5). Moreover, we offer you three sizes of ear tips to select.  Q3: When I use the earbuds to talk with others or listen to music. The earbuds appear to get stuck or disconnect with smartphone. What happened? A3: First, make sure you wear the earbuds properly. Besides, please make sure that there are no obstacles between the right earbud and your smartphone. Therefore, please keep the right earbud and your smartphone in the same direction in order to maintain the continuous stability of the signal.  Q4: I found that its breathing lights flash when charging earbuds. What's wrong? A4: If they flash, please check whether the charging cabin ran out or charging contacts have been clogged. Make sure the earbuds are properly placed in the charging cabin.   [TWS, Bluetooth 5.0]: adopts TWS technology, it is convenient for your sports, such as running, fitness. Advanced bluetooth 5.0 technology, ABLEGRID Pyxis support A2DP, AVRCP, HSP, HFP, 33ft stable bluetooth connection, no need to worry about cutting out. Just search bluetooth name ""AbleGrid Pyxis"" from your mobile phone to pair. After that, just pick up the earbuds and they will connect your devices automatically. [Immersive Sound + Clear Call]: Design with 10mm dynamic driver and Airoha AB1532 chipset, Pyxis wireless earbuds delivers CD-like audio by sending full music bandwidth, ensure you with crystal clear treble, resonated booming bass and true 3D surrounded sound experience. The lowest power consumption and Zero Dropout. Built-in CVC 6.0 noise-cancelling microphones allow you to listen and talk with enhanced stereo clear voice without interference. [Touch Control, Automatically Power on /off]: The touch control button is intelligent and sensitive, can achieve more functions. No pressure during touch control of music Play / Pause, Answer call / Hang Up, Next Song / Previous Song, Siri voice assistant. Automatically on when you take out earbuds from charging cabin, and automatically off when you put it into charging cabin. [25H Continuous Playtime]: Premium rechargeable battery allows bluetooth headphones to deliver 5 hours playtime, fully charged only with 45 minutes. Charging cabin built-in 400mAh battery, fully charged with 1.5H, which can refer extra 20 hours in the compact charging case. (Package include Micro-USB ). Warm tips: If you want to turn off breathing light, please press the touch panel 5s. [Comfort, Secure Fit, Warranty]: Ergonomic in-ear design, extra 6 silicone eartips of size S/M/L make sure earbuds snug and secure fit in your ears, they also create a better seal for enhanced noise isolation. IPX5 water resistant for workout, running, exercises and gym in all weather conditions. We support 18 months worry-free warranty, 24 hours professional service. ","['[TWS, Bluetooth 5.0]: adopts TWS technology, it is convenient for your sports, such as running, fitness. Advanced bluetooth 5.0 technology, ABLEGRID Pyxis support A2DP, AVRCP, HSP, HFP, 33ft stable bluetooth connection, no need to worry about cutting out. Just search bluetooth name ""AbleGrid Pyxis"" from your mobile phone to pair. After that, just pick up the earbuds and they will connect your devices automatically.', '[Immersive Sound + Clear Call]: Design with 10mm dynamic driver and Airoha AB1532 chipset, Pyxis wireless earbuds delivers CD-like audio by sending full music bandwidth, ensure you with crystal clear treble, resonated booming bass and true 3D surrounded sound experience. The lowest power consumption and Zero Dropout. Built-in CVC 6.0 noise-cancelling microphones allow you to listen and talk with enhanced stereo clear voice without interference.', '[Touch Control, Automatically Power on /off]: The touch control button is intelligent and sensitive, can achieve more functions. No pressure during touch control of music Play / Pause, Answer call / Hang Up, Next Song / Previous Song, Siri voice assistant. Automatically on when you take out earbuds from charging cabin, and automatically off when you put it into charging cabin.', '[25H Continuous Playtime]: Premium rechargeable battery allows bluetooth headphones to deliver 5 hours playtime, fully charged only with 45 minutes. Charging cabin built-in 400mAh battery, fully charged with 1.5H, which can refer extra 20 hours in the compact charging case. (Package include Micro-USB ). Warm tips: If you want to turn off breathing light, please press the touch panel 5s.', '[Comfort, Secure Fit, Warranty]: Ergonomic in-ear design, extra 6 silicone eartips of size S/M/L make sure earbuds snug and secure fit in your ears, they also create a better seal for enhanced noise isolation. IPX5 water resistant for workout, running, exercises and gym in all weather conditions. We support 18 months worry-free warranty, 24 hours professional service.']"
